unit_id,name,description,note,order,all_videos_copy
setting-context,Setting Context,"Explore how computers use numbers to represent and process information like images, sound, and text to solve real-world problems. Learn why understanding core computing concepts such as sequencing, decision-making, and iteration helps build a strong foundation for programming and problem-solving across different languages and fields.",,1,
computer-literacy,Computer Literacy,"Learn how computers represent information using numbers and explore how this allows them to process images, audio, text, and data efficiently. Understand how computing power helps us analyze and make sense of large-scale information in everyday contexts.",,2,
basics-of-computational-problem-solving-and-programming,Basics of Computational Problem Solving and Programming,"Learn how solving problems with code begins by understanding the task, designing a step-by-step solution, and translating that into a working program. Discover how this process often involves cycles of testing and fixing errors to refine and improve the final result.",,3,
naming-and-assignment,Naming and Assignment,"Learn how variables are used to store and manage information in a program through assignment statements and clear naming. Explore how different data types, calculations, and output statements help organize, manipulate, and present values. Practice writing and running simple programs in R and Python while learning how to test and debug your code step by step.",,4,
functions,Functions,"Learn how functions help organize and simplify code by grouping instructions that can be reused across different parts of a program. Understand how to call built-in and custom functions in Python and R using variables, expressions, and different argument types. Explore how to define your own functions to receive input, return output, and improve the flexibility and clarity of your code.",,5,
sequences-and-data-frames,Sequences and Data Frames,"Learn how sequences and data frames store and manage structured data in memory for efficient access and manipulation. Understand how to use indexing and conditional selection to retrieve or modify elements, rows, and columns in both R and Python. Explore how data frames differ from files on disk and how they serve as powerful tools for data analysis within a program.",,6,
troubleshooting,Troubleshooting,"Learn how to approach programming challenges by developing strategies for understanding documentation and troubleshooting errors. Understand how to interpret function references and fix common mistakes like syntax, runtime, and logic errors. Strengthen your problem-solving skills by learning how to test and refine your code with confidence.",,7,
control-flow,Control Flow,Learn how control flow directs the order in which code is executed and how variables are assigned and updated during a program’s run. Understand how values are stored in memory and how evaluating the right side of an assignment allows programs to update data accurately and predictably.,,8,